923,25010,GROUPE SCOLAIRE LA VICTOIRE / YABAYO,PRIVE,43,SOUBRE,7,7,2,28.57,0
924,875127,"INSTITUT DE MANAGEMENT, DE GESTION ET DE L’HOTELLERIE 
 (IMGH) (EXÂ - IACH) YOPOUGON",PRIVE,40,ABIDJAN 3,14,14,4,28.57,31.58
925,21376,INSTITUT INTERNATIONAL ADJELEBA (2IA) YOPOUGON,PRIVE,40,ABIDJAN 3,29,28,8,28.57,25.76
926,875013,INSTITUT SUPERIEUR DE TECHNOLOGIES APPLIQUEES ET COMMERCIALES (INSTAC) YOPOUGON,PRIVE,40,ABIDJAN 3,49,49,14,28.57,35.71
927,875033,LES PROFESSIONNELS SAN-PEDRO,PRIVE,19,SAN-PEDRO,63,63,18,28.57,23.19
928,528,LYCEE MODERNE VAVOUA,PUBLIC,15,DALOA,712,701,200,28.53,34.6
929,12202,INSTITUT NAKOI AGBOVILLE,PRIVE,22,AGBOVILLE,284,277,79,28.52,19.89
930,21309,COLLEGE LES OLIVIERS DE PORT-BOUET,PRIVE,31,ABIDJAN 2,218,214,61,28.5,36.73
931,41620,ACADEMIE JAMS KOUAME D'AHIGBE-KOFFIKRO,PRIVE,21,ABOISSO,189,186,53,28.49,24.24
932,190104,GROUPE SCOLAIRE BETHESDA PORT-BOUET,PRIVE,31,ABIDJAN 2,183,179,51,28.49,28.85
933,190145,COLLEGE LES TCHOYAS ADZOPE,PRIVE,32,ADZOPE,516,516,147,28.49,23.39
934,49659,COLLEGE PRIVE FRESC'EDUC DE FRESCO,PRIVE,55,SASSANDRA,155,151,43,28.48,26.6
935,192256,COLLEGE PRIVE GNAGNE AGNES MARCORY ALIODAN,PRIVE,31,ABIDJAN 2,283,281,80,28.47,24.46
936,54647,COLLEGE PRIVE SEUL DIEU BENIT DE YAKASSE-ATTOBROU,PRIVE,32,ADZOPE,130,130,37,28.46,26.8
937,224,COLLEGE CARNOT NIANGON-YOPOUGON,PRIVE,40,ABIDJAN 3,285,285,81,28.42,45.85
938,529,LYCEE MODERNE ZUENOULA,PUBLIC,34,BOUAFLE,281,278,79,28.42,27.67
939,54680,COLLEGE PRIVE LA FORMULE DE DAOUKRO,PRIVE,45,DAOUKRO,76,74,21,28.38,24
940,41647,COLLEGE PRIVE TECHNIQUE EPERLAN DE VAVOUA,PRIVE,15,DALOA,70,67,19,28.36,19.74
941,57987,COLLEGE PRIVE LE CAMPUS,PRIVE,49,BOUAKE 2,419,406,115,28.33,22.62
942,37007,CENTRE D'ETUDES SUPERIEURES DES AFFAIRES D'ABIDJAN ( CESA ) KOUMASSI,PRIVE,31,ABIDJAN 2,54,53,15,28.3,20.9
943,684,COLLEGE ATSE YAPI JOSEPH D’ADZOPE (EX-NESPA) ADZOPE,PRIVE,32,ADZOPE,354,350,99,28.29,28.68
944,17149,COLLEGE ALBERT SCHWEITZER SONGON M'BRATÉ,PRIVE,40,ABIDJAN 3,198,198,56,28.28,22.56
945,269,LYCEE MODERNE 1 NANGUI ABROGOUA ADJAME,PUBLIC,12,ABIDJAN 1,147,145,41,28.28,61.68
946,33321,COLLEGE LA PERFORMANCE BOUAKE,PRIVE,14,BOUAKE 1,46,46,13,28.26,20
947,190340,COLLEGE SAINT AUGUSTIN YOPOUGON KOWEIT,PRIVE,40,ABIDJAN 3,143,138,39,28.26,26
948,CS0280,COURS DU SOIR LE WOROBA,CS,41,ABIDJAN 4,48,46,13,28.26,0
949,190624,COLLEGE PRIVE TECHNIQUE CANAAN D'ARRAH,PRIVE,50,BONGOUANOU,227,216,61,28.24,20
950,41708,COLLEGE D'ENS. TECH. HARRIS MEMEL FOTE / MEAGUI,PRIVE,43,SOUBRE,40,39,11,28.21,0
951,12112,COLLEGE LE PETIT COLLEGE KOUMASSI,PRIVE,31,ABIDJAN 2,190,188,53,28.19,20.11
952,875115,INSTITUT SUPERIEUR DES CARRIERES COMMERCIALES (ISCC) TREICHVILLE,PRIVE,31,ABIDJAN 2,104,103,29,28.16,19.35
953,49609,COLLEGE DAR EL HADISSE DE BOUAKE,PRIVE,14,BOUAKE 1,32,32,9,28.13,25
954,516,COURS SECONDAIRE PROTESTANT JEAN CALVIN DALOA,PRIVE,15,DALOA,172,171,48,28.07,26.97
955,35411,COLLEGE BETHLEEM KORHOGO,PRIVE,16,KORHOGO,450,449,126,28.06,19.44
956,15014,LYCEE MODERNE LE PLANTEUR BARRY CALLEBAUT D'AKOUPE,PUBLIC,32,ADZOPE,83,82,23,28.05,49.52
957,41625,COLLEGE CYKRA / TANDA,PRIVE,13,BONDOUKOU,50,50,14,28,18.75
958,35268,COLLEGE LE JOURDAIN ABOISSO,PRIVE,21,ABOISSO,50,50,14,28,18.75
959,57959,COLLEGE PRIVE L'ELITE AHIGBE-KOFFIKRO,PRIVE,21,ABOISSO,26,25,7,28,27.27
960,190333,GROUPE ELITE DABOU,PRIVE,33,DABOU,50,50,14,28,34.21
961,13809,LYCEE MODERNE 3 DALOA,PUBLIC,15,DALOA,204,200,56,28,24.4
962,36050,GROUPE HARMONIE YOPOUGON NIANGON SUD GAUCHE,PRIVE,40,ABIDJAN 3,417,411,115,27.98,26.12
963,190163,ACADEMIE DU ROI DE GLOIRE DABOU,PRIVE,33,DABOU,86,86,24,27.91,32.93
964,39735,COLLEGE LES DEMIURGES DE KOKOUMBO,PRIVE,20,YAMOUSSOUKRO,44,43,12,27.91,31.88
965,190003,GROUPE SCOLAIRE FADIGA ABDOUL (GSFA) ABOBO,PRIVE,41,ABIDJAN 4,235,233,65,27.9,26.52
966,197238,COLLEGE PRIVE LE TEMPLE DU SAVOIR DE OUELLE,PRIVE,45,DAOUKRO,61,61,17,27.87,16.22
967,13819,LYCEE MODERNE 2 GAGNOA,PUBLIC,26,GAGNOA,431,427,119,27.87,40
968,9968,LYCEE SAINT GILBERT DE DJAGO ABOBO,PRIVE,41,ABIDJAN 4,377,377,105,27.85,24.49
969,250,COLLEGE LE PETIT CHAMPION ABOBO,PRIVE,41,ABIDJAN 4,231,230,64,27.83,38.56
970,190249,COLLEGE ENTENTE GAGNOA,PRIVE,26,GAGNOA,392,385,107,27.79,35.69
971,15021,COLLEGE MODERNE TORTIYA,PUBLIC,25,KATIOLA,36,36,10,27.78,0
972,57997,COLLEGE PRIVE LE BACHELIER D'IROBO,PRIVE,33,DABOU,72,72,20,27.78,24.56
973,58025,COLLEGE PRIVE PENIEL DE BAHOULIFLA,PRIVE,15,DALOA,18,18,5,27.78,0
974,CS0410,COURS DU SOIR ILE AU TRESOR,CS,41,ABIDJAN 4,36,36,10,27.78,0
975,722,LYCEE ADRIEN KOUASSI TOLLAH OUELLE,PUBLIC,45,DAOUKRO,263,263,73,27.76,23.66
976,299,COLLEGE SAINT MAURICE D'ALICOT KOUMASSI,PRIVE,31,ABIDJAN 2,228,227,63,27.75,15.92
977,35344,COLLEGE ANTILOPE DALOA,PRIVE,15,DALOA,298,292,81,27.74,20.86
978,13867,LYCEE MODERNE D'EBILASSOKRO,PUBLIC,11,ABENGOUROU,65,65,18,27.69,18.42
979,789,COLLEGE MUNICIPAL TAI,PUBLIC,28,GUIGLO,66,65,18,27.69,33.78
980,35161,GROUPE SCOLAIRE GERMINAL YOPOUGON,PRIVE,40,ABIDJAN 3,134,130,36,27.69,37.08
981,49608,COLLEGE PRIVE COGDIM DE BOUAFLE,PRIVE,34,BOUAFLE,160,159,44,27.67,10
982,197223,COLLEGE PRIVE ELISCHAMA DE DIVO,PRIVE,23,DIVO,213,206,57,27.67,17.35
983,58031,COLLEGE PRIVE SANKHORE,PRIVE,47,DANANE,192,188,52,27.66,8.09
984,875025,INSTITUT DE COMMERCE ET DE FINANCES (ISCF) ABOBO PLATEAU DOKUI,PRIVE,41,ABIDJAN 4,47,47,13,27.66,35.71
985,586,LYCEE MODERNE FLORENT DROH JACQUET DE MAN,PUBLIC,17,MAN,124,123,34,27.64,24.53
986,875059,UNIX ACADEMIE YOPOUGON,PRIVE,40,ABIDJAN 3,126,123,34,27.64,22.73
987,57934,COLLEGE PRIVE ADIAFFI DE BETTIE,PRIVE,11,ABENGOUROU,163,163,45,27.61,32.26
988,190065,COLLEGE MODERNE EXCELLENCE BOUAFLE,PRIVE,34,BOUAFLE,424,410,113,27.56,16.94
989,54669,COLLEGE PRIVE FLEUNON DE BAKAYO,PRIVE,43,SOUBRE,127,127,35,27.56,28.57
990,9958,GROUPE SCOLAIRE KONE IDRISSA YOPOUGON,PRIVE,40,ABIDJAN 3,141,138,38,27.54,32.26
991,33271,COLLEGE PRIVE LE COMMUNAL BONOUA,PRIVE,51,GRAND BASSAM,114,109,30,27.52,21.33
992,198309,COLLEGE PRIVE LE BACHELIER DE PORT-BOUET,PRIVE,31,ABIDJAN 2,40,40,11,27.5,8.51
993,190296,COLLEGE VICTOR LOBA DJOKOUEHI YOPOUGON ZONE CHU,PRIVE,40,ABIDJAN 3,42,40,11,27.5,36.67
994,37089,"INSTITUT INTERNATIONAL DE FORMATION TECHNIQUE (IIFORT) 
 YOPOUGON WASSAKARA",PRIVE,40,ABIDJAN 3,91,91,25,27.47,42.42
995,441,LYCEE ESSY AMARA DE KOUASSI-DATEKRO,PUBLIC,13,BONDOUKOU,91,91,25,27.47,14.29
996,198360,COLLEGE PRIVE LE PREMIER DE GRAND-LAHOU,PRIVE,33,DABOU,62,62,17,27.42,35
997,254,GROUPE SCOLAIRE FUSOS COURS SOCIAUX ABOBO,PRIVE,41,ABIDJAN 4,808,806,221,27.42,37.1
998,10978,GROUPE SCOLAIRE ADJA MADOUE TOURE ANYAMA,PRIVE,41,ABIDJAN 4,321,321,88,27.41,30.85
999,10666,COLLEGE SAINTE RUTH FIDELE BOUAKE,PRIVE,14,BOUAKE 1,76,73,20,27.4,29.9
1000,190007,GROUPE SCOLAIRE SAINT MATHIEU ABOBO,PRIVE,41,ABIDJAN 4,292,292,80,27.4,12.03
1001,35107,COLLEGE PRIVE CLAIRE FONTAINE YOPOUGON,PRIVE,40,ABIDJAN 3,460,446,122,27.35,19.77
1002,36009,COLLEGE D'ENSEIGNEMENT TECHNIQUE EKRA MATHIEU AGNIBILEKROU,PRIVE,11,ABENGOUROU,92,88,24,27.27,19.79
1003,710,COLLEGE KOFFI ACKANT DIMBOKRO,PRIVE,50,BONGOUANOU,56,55,15,27.27,20.31
1004,190269,COLLEGE LE BON BERGER DIVO,PRIVE,23,DIVO,134,132,36,27.27,19.27
1005,14202,COLLEGE MODERNE MOLONOUBLE,PUBLIC,20,YAMOUSSOUKRO,22,22,6,27.27,7.14
1006,198475,COLLEGE PRIVE ACADEMIE PLUS DE TIEBISSOU,PRIVE,20,YAMOUSSOUKRO,11,11,3,27.27,0
1007,41671,COLLEGE PRIVE LES BOYA / TAÏ,PRIVE,28,GUIGLO,26,22,6,27.27,8.7
1008,58202,COLLEGE PRIVE TECHNIQUE HAVILA DAOUKRO,PRIVE,45,DAOUKRO,44,44,12,27.27,0
1009,CS0428,COURS DU SOIR LE TIKA,CS,41,ABIDJAN 4,33,33,9,27.27,0
1010,37035,CTP HAVILA DAOUKRO,PRIVE,45,DAOUKRO,78,77,21,27.27,1.59
1011,12138,INSTITUT SAINTE COLETTE KOUMASSI,PRIVE,31,ABIDJAN 2,132,132,36,27.27,15.58
1012,13865,LYCEE MODERNE JACQUES BATTEUR D'AFFIENOU,PUBLIC,21,ABOISSO,59,55,15,27.27,16.25
1013,35171,GROUPE SCOLAIRE LES MIGNONS YOPOUGON,PRIVE,40,ABIDJAN 3,349,327,89,27.22,29.22
1014,54598,COLLEGE PRIVE ANUANDOH DE TANDA,PRIVE,13,BONDOUKOU,228,228,62,27.19,18.59
1015,774,LYCEE MODERNE OUME,PUBLIC,26,GAGNOA,733,732,199,27.19,27.82
1016,249,COLLEGE LE PANTHEON WILLIAMSVILLE,PRIVE,12,ABIDJAN 1,92,92,25,27.17,27.27
1017,9691,COLLEGE LE CHALLENGE DIMBOKRO,PRIVE,30,DIMBOKRO,131,129,35,27.13,42.53
1018,25016,COLLEGE PRIVE TECHNIQUE JEAN-BAPTISTE DE LA SALLE 2 D'ATTECOUBE,PRIVE,40,ABIDJAN 3,137,133,36,27.07,30.84
1019,49656,COLLEGE PRIVE KONE LANCINE DE DIANRA,PRIVE,54,MANKONO,88,85,23,27.06,30.77
1020,54618,COLLEGE PRIVE TENENA DENIS DE KOMBOLOKORO,PRIVE,16,KORHOGO,148,148,40,27.03,25.61
1021,10645,COLLEGE NEOPHYTE VRIDI,PRIVE,31,ABIDJAN 2,101,100,27,27,26.53
1022,58087,COLLEGE PRIVE MEMA KAMIN,PRIVE,47,DANANE,203,200,54,27,16.23
1023,CS0392,COURS DU SOIR MARIE PENIELLE,CS,41,ABIDJAN 4,102,100,27,27,0
1024,190112,COLLEGE JULES RONSARD 2 PORT-BOUET,PRIVE,31,ABIDJAN 2,368,363,98,27,43.61
1025,10643,COLLEGE LE GRAND II ADJAME,PRIVE,12,ABIDJAN 1,64,63,17,26.98,28.36
1026,190045,COLLEGE MAMADOU TRAORE YOPOUGON,PRIVE,40,ABIDJAN 3,153,152,41,26.97,34.11
1027,197305,COLLEGE PRIVE BERNARD DADIE D'ADZOPE,PRIVE,32,ADZOPE,55,52,14,26.92,0
1028,190265,COURS SECONDAIRE PROTESTANT CMA YAMOUSSOUKRO,PRIVE,20,YAMOUSSOUKRO,26,26,7,26.92,22.58
1029,875088,GLOBAL FORMATION INSERTION (GFI) GRAND-BASSAM,PRIVE,51,GRAND BASSAM,27,26,7,26.92,36.36
1030,12300,LYCEE NANAN ADEPRA DE BETTIE,PUBLIC,11,ABENGOUROU,54,52,14,26.92,17
1031,228,COLLEGE CHATEAUBRIAND DABOU,PRIVE,33,DABOU,327,327,88,26.91,37.33
1032,190240,IFED DALOA,PRIVE,15,DALOA,177,171,46,26.9,20
1033,54650,COLLEGE PRIVE LE PRESTIGE DE BOUAFLE,PRIVE,34,BOUAFLE,236,227,61,26.87,13.64
1034,537,COLLEGE ALFA KEITA OUANGOLODOUGOU,PRIVE,48,FERKESSEDOUGOU,67,67,18,26.87,35.71
1035,190124,GROUPE SCOLAIRE CLAIRE ANGE SAN-PEDRO,PRIVE,19,SAN-PEDRO,290,283,76,26.86,29.11
1036,707,COLLEGE DE KOUADIO M'BATTO,PRIVE,50,BONGOUANOU,90,82,22,26.83,13.93
1037,190605,GROUPE SCOLAIRE LES LAURIERS SINFRA,PRIVE,46,SINFRA,167,164,44,26.83,36.11
1038,809,LYCEE BAD TIENINGBOUE,PUBLIC,54,MANKONO,126,123,33,26.83,20
1039,13057,COLLEGE SAINT BRICE YOPOUGON,PRIVE,40,ABIDJAN 3,200,198,53,26.77,37.61
1040,10438,GROUPE SCOLAIRE KOUADIO GERMAIN SAKASSOU,PRIVE,49,BOUAKE 2,144,142,38,26.76,17.39
1041,21337,COLLEGE EMMAUS BONGOUANOU,PRIVE,50,BONGOUANOU,226,217,58,26.73,34.03
1042,197250,COLLEGE PRIVE LES PEDAGOGUES DU PONGALA,PRIVE,27,BOUNDIALI,105,105,28,26.67,23.81
1043,36074,GROUPE SUCCES ABOBO PLATEAUX-DOKUI,PRIVE,41,ABIDJAN 4,30,30,8,26.67,36
1044,190099,INSTITUT SCOLAIRE SECONDAIRE ESSEIGOU AKA (ISSEA) ABOBO,PRIVE,41,ABIDJAN 4,503,495,132,26.67,22.62
1045,35422,COLLEGE PRIVE DES PROFESSEURS DE MAN,PRIVE,17,MAN,389,379,101,26.65,18.21
1046,35086,GROUPE SCOLAIRE LABION MAXIME PORT-BOUET PETIT-BASSAM,PRIVE,31,ABIDJAN 2,110,109,29,26.61,15.85
1047,35253,GROUPE SCOLAIRE LES HIRONDELLES ABOBO SAGBE,PRIVE,41,ABIDJAN 4,504,504,134,26.59,24.95
1048,14987,LYCEE MODERNE D'ANIASSUE,PUBLIC,11,ABENGOUROU,81,79,21,26.58,20.93
1049,12113,COLLEGE PRIVE ABRAHAM PORT BOUET,PRIVE,31,ABIDJAN 2,99,98,26,26.53,25
1050,190327,COLLEGE LE SOUVERAIN YOPOUGON GARE,PRIVE,40,ABIDJAN 3,503,483,128,26.5,27.52
1051,58082,COLLEGE PRIVE YATANA DE KORHOGO,PRIVE,16,KORHOGO,636,634,168,26.5,22.29
1052,875152,COLLEGE PRIVE EPCT DE BOUAKE,PRIVE,49,BOUAKE 2,154,151,40,26.49,24.73
1053,581,COLLEGE CATHOLIQUE SAINT HENRI DE OSSO MAN,PRIVE,17,MAN,36,34,9,26.47,33.33
1054,57989,COLLEGE PRIVE MOUAYET DE DIABO,PRIVE,49,BOUAKE 2,129,121,32,26.45,30.19
1055,54700,COLLEGE LOUIS HENRI GAH DE BIN-HOUYE,PRIVE,47,DANANE,88,87,23,26.44,4.44
1056,460,COLLEGE YAMOUSSO MARIE THERESE BOUAKE,PRIVE,49,BOUAKE 2,370,367,97,26.43,36.08
1057,190219,GROUPE SCOLAIRE SAINT CYR 2 PORT-BOUET,PRIVE,31,ABIDJAN 2,663,640,169,26.41,26.5
1058,39714,COLLEGE LEON GONTRAN DAMAS DE VAVOUA,PRIVE,15,DALOA,251,250,66,26.4,21.38
1059,190319,COLLEGE LA BONNE ETOILE SOUBRE,PRIVE,43,SOUBRE,76,72,19,26.39,24.59
1060,499,LYCEE MODERNE BAD GOHITAFLA,PUBLIC,34,BOUAFLE,131,129,34,26.36,32.62
1061,13813,LYCEE MODERNE 2 DIVO,PUBLIC,23,DIVO,319,319,84,26.33,30.98
1062,58021,COLLEGE PRIVE LES ETOILES DE SERIA,PRIVE,15,DALOA,38,38,10,26.32,15.22
1063,198207,COLLEGE PRIVE NGUESSAN APPIA DE N'DOUCI,PRIVE,42,TIASSALE,19,19,5,26.32,0
1064,CS0307,COURS DU SOIR VEHUIAH,CS,41,ABIDJAN 4,61,57,15,26.32,0
1065,456,COLLEGE LA RENAISSANCE BOUAKE,PRIVE,49,BOUAKE 2,349,346,91,26.3,26.53
1066,8817,COLLEGE GUE PASCAL MAN,PRIVE,17,MAN,487,484,127,26.24,14.73
1067,190638,COLLEGE LAPLACE ABOBO AKEIKOI,PRIVE,41,ABIDJAN 4,263,263,69,26.24,32.97
1068,13049,GROUPE SCOLAIRE LES SAINTS ANGES YOPOUGON,PRIVE,40,ABIDJAN 3,884,877,230,26.23,26.11
1069,10659,GROUPE SCOLAIRE LE LABEL VAVOUA,PRIVE,15,DALOA,217,210,55,26.19,6
1070,579,COLLEGE DIETY FELIX ( EX-ROUSSEAU) DANANE,PRIVE,47,DANANE,527,527,138,26.19,25.75
1071,39705,COLLEGE PRIVE MAMADOU COULIBALY DE ABOBO SAMAKE,PRIVE,41,ABIDJAN 4,191,191,50,26.18,21.43
1072,57985,COLLEGE PRIVE LA NOUVELLE JERUSALEM,PRIVE,49,BOUAKE 2,65,65,17,26.15,8.7
1073,190235,COLLEGE SAINT YANN EMMANUEL YOPOUGON NIANGON BASE CIE,PRIVE,40,ABIDJAN 3,135,130,34,26.15,44.52
1074,476,LYCEE MODERNE NANAN KHISSY BEYNIOUAH FULBERT DE DIABO,PUBLIC,49,BOUAKE 2,131,130,34,26.15,25
1075,629,LYCEE MUNICIPAL BUYO,PUBLIC,43,SOUBRE,436,436,114,26.15,25.37
1076,35370,COLLEGE NOTRE DAME DU SECOURS 3 TIEMELEKRO,PRIVE,50,BONGOUANOU,90,88,23,26.14,33.33
1077,12248,LYCEE MODERNE KFW GUEYO,PUBLIC,43,SOUBRE,203,199,52,26.13,45.14
1078,33379,GROUPE SCOLAIRE LES PERLES LAKOTA,PRIVE,23,DIVO,437,429,112,26.11,14.58
1079,190329,COLLEGE PRIVE TECHNIQUE MUPES D'AGNIBILEKROU,PRIVE,11,ABENGOUROU,729,728,190,26.1,19.58
1080,49658,COLLEGE PRIVE NOUR ISLAM DOUMBOUYA DE SAN-PEDRO,PRIVE,19,SAN-PEDRO,23,23,6,26.09,0
1081,190177,COURS SEC. GL LES CULTIVES YOPOUGON WASSAKARA,PRIVE,40,ABIDJAN 3,164,161,42,26.09,25.14
1082,59022,GROUPE IFDEC-INTERNATIONAL ABOBO,PRIVE,41,ABIDJAN 4,46,46,12,26.09,0
1083,49623,COLLEGE PRIVE LE CLERGEON DE DALOA,PRIVE,15,DALOA,218,211,55,26.07,13.53
1084,35220,COLLEGE LE SERMENT COCODY,PRIVE,12,ABIDJAN 1,119,119,31,26.05,35.71
1085,54620,COLLEGE PRIVE NONHOLO DE MADINANI,PRIVE,18,ODIENNE,119,119,31,26.05,36.17
1086,310,COLLEGE SEPI YOPOUGON,PRIVE,40,ABIDJAN 3,98,96,25,26.04,50
1087,190629,COLLEGE SOCIAL SIMONE GBAGBO PORT- BOUET ADJOUFFOU,PRIVE,31,ABIDJAN 2,97,96,25,26.04,21.6
1088,41669,COLLEGE PRIVE TECHNIQUE DOUZOUO LIGUE DE GALEBRE,PRIVE,26,GAGNOA,73,73,19,26.03,37.84
1089,21325,COLLEGE LES ETOILES DE SAMO BONOUA,PRIVE,51,GRAND BASSAM,131,131,34,25.95,31.25
1090,375,CENTRE D’ENSEIGNEMENT TECHNIQUE FEMININ (CETF) NOTRE DAME DE LA PAIX TREICHVILLE,PRIVE,31,ABIDJAN 2,84,81,21,25.93,20
1091,21311,COLLEGE AMADOU HAMPATE BA YOPOUGON,PRIVE,40,ABIDJAN 3,55,54,14,25.93,39.2
1092,10656,COLLEGE DORIAN YOPOUGON,PRIVE,40,ABIDJAN 3,138,135,35,25.93,23.27
1093,49671,COLLEGE MAKINDE DE YAMOUSSOUKRO,PRIVE,20,YAMOUSSOUKRO,56,54,14,25.93,8
1094,12142,COLLEGE MUNICIPAL DJEBONOUA,PUBLIC,14,BOUAKE 1,109,108,28,25.93,22.83
1095,190226,COLLEGE NOVALIME YOPOUGON PORT-BOUET 2,PRIVE,40,ABIDJAN 3,56,54,14,25.93,24.32
1096,57994,COLLEGE PRIVE LE PAVILLON DE TENGRELA,PRIVE,27,BOUNDIALI,226,220,57,25.91,12.63
1097,190228,GROUPE SCOLAIRE ELEVATION JACQUEVILLE,PRIVE,33,DABOU,151,151,39,25.83,42.06
1098,9363,COLLEGE JEAN DELAFOSSE TOUMODI,PRIVE,20,YAMOUSSOUKRO,36,31,8,25.81,13.33
1099,58451,COLLEGE PRIVE SEGBE DE PRIKRO,PRIVE,45,DAOUKRO,158,155,40,25.81,17.31
1100,685,LYCEE MUNICIPAL AFFERY,PUBLIC,32,ADZOPE,284,283,73,25.8,21.57
1101,190334,COLLEGE DEGRE LAKOTA,PRIVE,23,DIVO,97,97,25,25.77,12.94
1102,58056,COLLEGE PRIVE ESPOIR DE OUANGOLODOUGOU,PRIVE,48,FERKESSEDOUGOU,101,97,25,25.77,22.64
1103,17159,COLLEGE GRACE MARIE GAGNOA,PRIVE,26,GAGNOA,68,66,17,25.76,26.32
1104,190118,COLLEGE LA CONCORDE BOUAFLE,PRIVE,34,BOUAFLE,238,233,60,25.75,23.08
1105,673,COLLEGE DECROLY AGBOVILLE,PRIVE,22,AGBOVILLE,169,167,43,25.75,20.8
1106,190144,COLLEGE MUPRED ABOISSO,PRIVE,21,ABOISSO,280,272,70,25.74,20
1107,190181,GROUPE SCOLAIRE SAINTE ADJOUA FADETTE YOPOUGON,PRIVE,40,ABIDJAN 3,482,482,124,25.73,46.08
1108,190014,COLLEGE ATLANTIQUE DE PORT-BOUET,PRIVE,31,ABIDJAN 2,669,669,172,25.71,28.98
1109,190317,COPESS SAN-PEDRO,PRIVE,19,SAN-PEDRO,429,424,109,25.71,29.21
1110,468,GROUPE SCOLAIRE MOHAMED V BOUAKE,PRIVE,14,BOUAKE 1,319,319,82,25.71,28.16
1111,190312,GROUPE SCOLAIRE FRATERNITE KONONFLA,PRIVE,46,SINFRA,393,393,101,25.7,10.66
1112,10980,COLLEGE ATLAS D'ANYAMA GARE,PRIVE,41,ABIDJAN 4,361,358,92,25.7,24.37
1113,539,COLLEGE BEMA COULIBALY KORHOGO,PRIVE,16,KORHOGO,74,74,19,25.68,22.35
1114,190288,GROUPE SCOLAIRE DES ARTS ET DES METIERS (GSAM) KOUMASSI,PRIVE,31,ABIDJAN 2,219,219,56,25.57,29.34
1115,8805,COLLEGE D'ENSEIGNEMENT SECONDAIRE KOUMASSI,PRIVE,31,ABIDJAN 2,223,223,57,25.56,23.46
1116,190151,GROUPE SCOLAIRE LES BENOITS DIVO,PRIVE,23,DIVO,92,90,23,25.56,21.62
1117,190302,GS INTERNATIONAL DES ENSEIGNANTS ABOISSO,PRIVE,21,ABOISSO,185,184,47,25.54,15.25
1118,198276,COLLEGE PRIVE BEL HORIZON DE NIAKARAMADOUGOU,PRIVE,25,KATIOLA,48,47,12,25.53,26.32
1119,49617,COLLEGE PRIVE LE YAYUS DE IROBO,PRIVE,33,DABOU,47,47,12,25.53,15.63
1120,58169,COLLEGE PRIVE TECHNIQUE NOTRE DAME DE LA PAIX,PRIVE,22,AGBOVILLE,47,47,12,25.53,0
1121,41686,COLLEGE PRIVE MUFAS SASSANDRA,PRIVE,55,SASSANDRA,326,326,83,25.46,22.61
1122,CS0261,COURS DU SOIR DIVINE ROSEE,CS,41,ABIDJAN 4,55,55,14,25.45,0
1123,33258,GROUPE SCOLAIRE RITA ROSANE ABOBO,PRIVE,41,ABIDJAN 4,110,110,28,25.45,35.53
1124,54649,COLLEGE PRIVE PIERRE SIMON DE JACQUEVILLE,PRIVE,33,DABOU,114,114,29,25.44,37.21
1125,13070,INSTITUT TECHNIQUE GRACE DIVINE DIVO,PRIVE,23,DIVO,229,228,58,25.44,22.22
1126,21315,GROUPE SCOLAIRE AKOUNDA YOPOUGON,PRIVE,40,ABIDJAN 3,125,118,30,25.42,30.3
1127,13883,LYCEE MODERNE DE SEGUELON,PUBLIC,18,ODIENNE,60,59,15,25.42,11.54
1128,294,COLLEGE SAINT EXUPERY PORT-BOUET,PRIVE,31,ABIDJAN 2,605,602,153,25.42,40.25
1129,17227,LYCEE MODERNE DE ZARANOU,PUBLIC,11,ABENGOUROU,71,71,18,25.35,22.58
1130,1101,COLLEGE ASCENSION DAOUKRO,PRIVE,45,DAOUKRO,228,225,57,25.33,30.14
1131,54641,COLLEGE PRIVE MEDEB DE BLOLEQUIN,PRIVE,28,GUIGLO,181,170,43,25.29,19.83
1132,10972,GROUPE SCOLAIRE AMICHIA YOPOUGON,PRIVE,40,ABIDJAN 3,87,87,22,25.29,32.74
1133,190173,COLLEGE WALI YOPOUGON GARE SABLE,PRIVE,40,ABIDJAN 3,103,103,26,25.24,32.91
1134,190306,COLLEGE ZIADEMAN SAINT BERTIN GUÉSSABO,PRIVE,15,DALOA,119,111,28,25.23,0
1135,190270,GROUPE SCOLAIRE AKONDA N'DOUCI,PRIVE,42,TIASSALE,224,222,56,25.23,46.5
1136,14923,COLLEGE MODERNE BAYOTA,PUBLIC,26,GAGNOA,140,139,35,25.18,22.94
1137,9967,GROUPE SCOLAIRE LES ELITES ABOBO,PRIVE,41,ABIDJAN 4,405,394,99,25.13,15.2
1138,198489,COLLEGE PRIVE ACADEMIE DES ELITES DE SAN-PEDRO,PRIVE,19,SAN-PEDRO,215,211,53,25.12,30.22
1139,13880,LYCEE MODERNE DE GADOUHAN,PUBLIC,15,DALOA,276,271,68,25.09,16.5
1140,12213,COLLEGE SAINT JOSEPH ABENGOUROU,PRIVE,11,ABENGOUROU,400,399,100,25.06,20.2
1141,875024,CENTRE D’ENSEIGNEMENT SUPERIEUR TECHNIQUE ET PROFESSIONNEL (CESTP) KIBIO COCODY 2 PLATEAUX,PRIVE,12,ABIDJAN 1,16,16,4,25,0
1142,723,COLLEGE AHIANOT LAKOTA,PRIVE,23,DIVO,243,236,59,25,22.54
1143,21336,COLLEGE ALPHONSE ALLIRAND M'BATTO,PRIVE,50,BONGOUANOU,13,12,3,25,0
1144,190018,COLLEGE BOCABO ET ASSOCIES ABOBO,PRIVE,41,ABIDJAN 4,196,196,49,25,10.17
1145,226,COLLEGE CHARLES DE FOUCAULD DABOU,PRIVE,33,DABOU,20,20,5,25,59.26
1146,11117,COLLEGE D'ENSEIG. SECOND. TECHNIQUE LOGOUALE,PRIVE,17,MAN,99,96,24,25,11.16
1147,436,COLLEGE DUA KOBENAN BONDOUKOU,PRIVE,13,BONDOUKOU,172,168,42,25,20.34
1148,437,COLLEGE HONORE DE BALZAC BONDOUKOU,PRIVE,13,BONDOUKOU,245,244,61,25,27.88
1149,8807,COLLEGE KADJE YOPOUGON,PRIVE,40,ABIDJAN 3,8,8,2,25,100
1150,41636,COLLEGE PRIVE ADONAI N'DJEM JACQUEVILLE,PRIVE,33,DABOU,28,28,7,25,20
1151,49663,COLLEGE PRIVE BELLE CÔTE DE MEAGUI,PRIVE,43,SOUBRE,148,144,36,25,17.14
1152,568,COLLEGE PRIVE DIAWAR MAN,PRIVE,17,MAN,124,124,31,25,16.31
1153,769,COLLEGE PRIVE DJEDJE BAGNON DE SINFRA,PRIVE,46,SINFRA,103,100,25,25,21.91
1154,58049,COLLEGE PRIVE ESPERANCE DE BANGOLO,PRIVE,53,DUEKOUE,12,12,3,25,0
1155,57975,COLLEGE PRIVE KAVOETCHEVA,PRIVE,34,BOUAFLE,9,8,2,25,0
1156,54631,COLLEGE PRIVE LE BOUTOUROU DE NASSIAN,PRIVE,24,BOUNA,119,116,29,25,24.36
1157,54591,COLLEGE PRIVE LES ORFEVRES D'AGNIBILIKROU,PRIVE,11,ABENGOUROU,276,272,68,25,27.47
1158,35067,COLLEGE PRIVE MALLET PORT-BOUET,PRIVE,31,ABIDJAN 2,561,548,137,25,30.72
1159,197327,COLLEGE PRIVE TECHNIQUE LA PERRUCHE D'ANYAMA,PRIVE,41,ABIDJAN 4,24,24,6,25,0
1160,58157,COLLEGE PRIVE TECHNIQUE NABIHI NOUHOUM,PRIVE,15,DALOA,4,4,1,25,15.38
1161,54689,COLLEGE PRIVE TESLA DE BOUAKE,PRIVE,49,BOUAKE 2,308,300,75,25,33.17
1162,54612,COLLEGE PRIVE THAUSSONI DE GNAMANOU,PRIVE,15,DALOA,4,4,1,25,0
1163,190195,COLLEGE TOURE KANVALY ANYAMA,PRIVE,41,ABIDJAN 4,104,104,26,25,29.82
1164,190347,COLLEGE UFFONZE AFFERY,PRIVE,32,ADZOPE,101,100,25,25,13.33
1165,CS0473,COURS DU LES FLORILEGES,CS,41,ABIDJAN 4,12,12,3,25,0
1166,CS0359,COURS DU SOIR DOYALAMA,CS,31,ABIDJAN 2,57,56,14,25,0
1167,CS0538,COURS DU SOIR LE MONT SINAI,CS,41,ABIDJAN 4,64,64,16,25,0
1168,CS0470,CS LA GRACE,CS,40,ABIDJAN 3,4,4,1,25,0
1169,190110,CTP BOH VALENTIN ABOBO,PRIVE,41,ABIDJAN 4,276,272,68,25,27.33
1170,190300,GROUPE SCOLAIRE FATYMA 2 YOPOUGON MAROC,PRIVE,40,ABIDJAN 3,8,8,2,25,0
1171,35169,GROUPE SCOLAIRE LES BOURGEONS YOPOUGON,PRIVE,40,ABIDJAN 3,48,48,12,25,25.53
1172,33093,GROUPE SCOLAIRE NYL'S DE PORT-BOUET GONZAGUEVILLE,PRIVE,31,ABIDJAN 2,43,40,10,25,33.33
1173,672,INST ACADEMIQUE EBENEZER(EX DAOUDA COULIBALY)AGBOVILLE,PRIVE,22,AGBOVILLE,61,60,15,25,9.09
1174,59070,INSTITUT POLYTECHNIQUE GLORIS,PRIVE,40,ABIDJAN 3,16,16,4,25,0
1175,875137,INSTITUT TECHNIQUE SECONDAIRE PROFESSIONNEL (ITSP) ADJAME,PRIVE,12,ABIDJAN 1,127,124,31,25,22.02
1176,CS0475,ONG DJISSA FORMATION,CS,46,SINFRA,10,8,2,25,0
1177,37501,OUOTRO VIGNON MATHIEU-FORMATION (OVM-FORMATION) DUEKOUE,PRIVE,17,MAN,4,4,1,25,0
1178,54695,COLLEGE PRIVE BOYANAHO DE BANGOLO,PRIVE,53,DUEKOUE,234,233,58,24.89,8.81
1179,190213,COLLEGE NOTRE DAME DES LAGUNES PORT-BOUET,PRIVE,31,ABIDJAN 2,674,663,165,24.89,23.16
1180,17162,COLLEGE IFPG FERKESSEDOUGOU,PRIVE,48,FERKESSEDOUGOU,173,173,43,24.86,13.08
1181,49575,COLLEGE PRIVE GNACANACI EXCELLENCE DE BINGERVILLE,PRIVE,12,ABIDJAN 1,161,161,40,24.84,17.27
1182,190013,COLLEGE YVAC ANYAMA,PRIVE,41,ABIDJAN 4,471,471,117,24.84,33.11
1183,9963,LYCEE MODERNE GOSSO YABAYOU ALPHONSE DE GRAND BEREBY,PUBLIC,19,SAN-PEDRO,312,310,77,24.84,32.25
1184,35202,COLLEGE AOF ABOBO AVOCATIER,PRIVE,41,ABIDJAN 4,129,129,32,24.81,32.61
1185,57963,COLLEGE PRIVE FOHOUNDI D'AKOUPE,PRIVE,32,ADZOPE,126,121,30,24.79,10.9
1186,604,GROUPE SCOLAIRE MAMADOU COULIBALY ODIENNE,PRIVE,18,ODIENNE,363,359,89,24.79,19.29
1187,54630,COLLEGE PRIVE VERSANTS DU LAC DE DIVO,PRIVE,23,DIVO,93,93,23,24.73,0
1188,41643,COLLEGE LE ROSIER DALOA,PRIVE,15,DALOA,94,89,22,24.72,9.52
1189,620,COLLEGE GBAO SEBO MEAGUI,PRIVE,43,SOUBRE,259,259,64,24.71,14.17
1190,197113,COLLEGE PRIVE LE CHANDELIER DES ASSEMBLEES DE DIEU DE OUEOULO,PRIVE,19,SAN-PEDRO,77,77,19,24.68,0
1191,12470,LYCEE MUNICIPAL DIEGONEFLA,PUBLIC,26,GAGNOA,444,434,107,24.65,31.84
1192,197239,COLLEGE PRIVE ENTENTE 21 DE OUELLE,PRIVE,45,DAOUKRO,198,195,48,24.62,22.97
1193,41679,COLLEGE PRIVE TENIN KARNA DE KORHOGO,PRIVE,16,KORHOGO,585,581,143,24.61,25
1194,12204,COLLEGE EULALIE BLAH ABOBO CLOUETCHA,PRIVE,41,ABIDJAN 4,286,285,70,24.56,24.79
1195,787,COLLEGE SEKALA GUIGLO,PRIVE,28,GUIGLO,177,171,42,24.56,20.48
1196,513,COLLEGE SAINT RAPHAËL BOUAFLE,PRIVE,34,BOUAFLE,288,277,68,24.55,21.19
1197,197297,COLLEGE PRIVE M'BOUAFOUE D'AGBOVILLE,PRIVE,22,AGBOVILLE,53,53,13,24.53,20
1198,197221,COLLEGE PRIVE LOTUS DE LAKOTA,PRIVE,23,DIVO,379,359,88,24.51,10.26
1199,190311,COLLEGE L'INTELLIGENT DIVO,PRIVE,23,DIVO,311,306,75,24.51,23.4
1200,198399,COLLEGE PRIVE LA DESTINEE DE YOPOUGON,PRIVE,40,ABIDJAN 3,50,49,12,24.49,0
1201,15018,COLLEGE MUNICIPAL ANOUMABA,PUBLIC,50,BONGOUANOU,92,90,22,24.44,19.61
1202,57991,COLLEGE PRIVE LES ETOILES DE LA SAVANE,PRIVE,24,BOUNA,82,82,20,24.39,35.29
1203,875107,HAUTE ECOLE SUPERIEURE D’ADMINISTRATION DE COMMERCE ET DE MANAGEMENT (HT-ESACOM) SAN-PEDRO,PRIVE,19,SAN-PEDRO,126,123,30,24.39,8.06
1204,677,COLLEGE JACQUES AKA AGBOVILLE,PRIVE,22,AGBOVILLE,366,357,87,24.37,16.94
1205,623,COLLEGE LES LUTINS SAN-PEDRO,PRIVE,19,SAN-PEDRO,157,156,38,24.36,16.72
1206,10734,GROUPE SCOLAIRE LES PETITS SOLEILS / YOPOUGON,PRIVE,40,ABIDJAN 3,468,464,113,24.35,52.4
1207,190622,COLLEGE L'AVENIR BOUAKE,PRIVE,49,BOUAKE 2,37,37,9,24.32,17.54
1208,58155,COLLEGE PRIVE TECHNIQUE INPM,PRIVE,50,BONGOUANOU,74,74,18,24.32,20
1209,39719,COLLEGE VICTOIRE DE LA GRACE DIVINE DE OUME,PRIVE,26,GAGNOA,143,140,34,24.29,14.19
1210,875066,COURS ET CABINET ESCACC SAN-PEDRO,PRIVE,19,SAN-PEDRO,137,136,33,24.26,14.38
1211,302,COLLEGE SAINT SAUVEUR MEMNI,PRIVE,32,ADZOPE,67,66,16,24.24,36.67
1212,10419,LYCEE MUNICIPAL MAFERE,PUBLIC,21,ABOISSO,265,264,64,24.24,21.18
1213,33307,COLLEGE PRIVE MAHAMA OUATTARA BONDOUKOU,PRIVE,13,BONDOUKOU,234,227,55,24.23,25
1214,25018,COLLEGE EMMANUELLA ABIGAELLE EHANIA,PRIVE,21,ABOISSO,195,194,47,24.23,12.68
1215,550,INSTITUT DE FORMATION PROFESSIONNELLE ET GENERALE (IFPG) KORHOGO,PRIVE,16,KORHOGO,584,582,141,24.23,17.2
1216,875090,COURS SECONDAIRE TECHNIQUE SEVIC KOUMASSI,PRIVE,31,ABIDJAN 2,62,62,15,24.19,6.06
1217,12282,COLLEGE SIA ANDRE MAN,PRIVE,17,MAN,348,339,82,24.19,14.18
1218,275,COLLEGE MONTHERLANT ADJAME,PRIVE,12,ABIDJAN 1,153,153,37,24.18,30.56
1219,49583,COLLEGE LE PEDAGOGUE DE PORT-BOUET GONZAGUEVILLE,PRIVE,31,ABIDJAN 2,114,112,27,24.11,31.67
1220,CS0330,COURS DU SOIR LE PHENIX,CS,41,ABIDJAN 4,116,112,27,24.11,0
1221,336,GROUPE SCOLAIRE ENTENTE KOUMASSI,PRIVE,31,ABIDJAN 2,412,411,99,24.09,24.29
1222,CS0332,COURS DU SOIR LES EXAUCES,CS,41,ABIDJAN 4,54,54,13,24.07,0
1223,58159,GROUPE SCOLAIRE E.F.I.T.E,PRIVE,45,DAOUKRO,54,54,13,24.07,0
1224,190044,COLLEGE JEAN FRANCOIS LIONEL YOPOUGON,PRIVE,40,ABIDJAN 3,50,50,12,24,51.85
1225,190643,COLLEGE PRIVE DOUMBIA ADAMA ADAM'S DE ANYAMARESIDENTIEL,PRIVE,41,ABIDJAN 4,50,50,12,24,8.33
1226,21313,COLLEGE PRIVE LES ARCANES YOPOUGON MAROC,PRIVE,40,ABIDJAN 3,25,25,6,24,41.07
1227,49593,COLLEGE PRIVE NOVIE D'ATTINGUIE,PRIVE,41,ABIDJAN 4,25,25,6,24,21.43
1228,190626,COLLEGE ALABA ADIAKE,PRIVE,21,ABOISSO,296,296,71,23.99,15.42
